[
  {
    "schema_version": "1.1",
    "id": "demo-amara-nwosu",
    "name": "Amara Nwosu",
    "pronouns": "she/her",
    "headline": "Distributed systems architect — payments and ledger platforms at national scale",
    "summary": "I design ledgers and settlement systems that must never lose a penny. Most of my work sits where correctness, regulators and very high throughput meet.",
    "seniority": "principal",
    "region": "uk",
    "location": {
      "country": "GB",
      "city": "Manchester"
    },
    "timezone": "UTC",
    "working_hours_overlap": {
      "earliest_start_utc": "07:00",
      "latest_end_utc": "19:00"
    },
    "work_preferences": [
      "contract_b2b",
      "fulltime_eor"
    ],
    "availability": "1_month",
    "languages": [
      {
        "language": "English",
        "proficiency": "native"
      },
      {
        "language": "Yoruba",
        "proficiency": "fluent"
      }
    ],
    "core_competencies": [
      "distributed-systems",
      "event-sourcing",
      "kafka",
      "postgresql",
      "go",
      "payments",
      "system-design",
      "technical-leadership"
    ],
    "major_impact": [
      {
        "title": "Rebuilt the settlement ledger for a national payments scheme",
        "role": "Lead architect",
        "organization": "UK payments infrastructure provider",
        "summary": "Replaced a nightly batch ledger with an event-sourced double-entry ledger, so settlement could run in near real time while keeping every entry auditable.",
        "architecture": [
          "event-sourcing",
          "kafka",
          "postgresql",
          "go"
        ],
        "metrics": [
          "Settlement window: 24h → 90s",
          "Zero reconciliation breaks in production",
          "40M entries/day"
        ]
      },
      {
        "title": "Brought a fintech's platform team from 3 to 22 engineers",
        "role": "Head of platform",
        "summary": "Set up the platform group, wrote the RFC process and on-call model, and moved services onto a shared deployment platform.",
        "metrics": [
          "Deploy frequency 4×",
          "MTTR down 70%"
        ]
      }
    ],
    "proof_of_work": [
      {
        "title": "ledger-kit — double-entry primitives for Go",
        "url": "https://github.com/example/ledger-kit",
        "type": "repository",
        "description": "Library for idempotent, append-only accounting entries."
      },
      {
        "title": "Talk: Exactly-once is a lie, idempotency is not",
        "url": "https://example.com/talks/idempotency",
        "type": "talk"
      }
    ],
    "vouches": [
      {
        "vouched_by": "Tom Reyes",
        "vouched_by_github": "example-treyes",
        "relationship": "manager",
        "statement": "Amara owned the ledger redesign end to end. It is the most reliable system I have run.",
        "date": "2026-08-02",
        "signature_format": "ssh",
        "public_key_fingerprint": "SHA256:nBife5cBzieZjKD/0fFLbHg4UFVsctqEqgmhmdBR3rA",
        "signature": "-----BEGIN SSH SIGNATURE-----\nU1NIU0lHAAAAAQAAADMAAAALc3NoLWVkMjU1MTkAAAAgW06yFGqUgBHu4ee+o4042fLlHa\nCGvimX87rtXnjcL8AAAAAUdGhlLXJlc3Qtb2YtdXMtdm91Y2gAAAAAAAAABnNoYTUxMgAA\nAFMAAAALc3NoLWVkMjU1MTkAAABA/RP8Wtb/Rgz/8GCY1eXq3H/iWDRMOtlBSgPsxBnZlB\n2ZBUWd3PE/cq6rWyeGgMNG61Lb0jpeXTpSkvRLQbHGBA==\n-----END SSH SIGNATURE-----"
      },
      {
        "vouched_by": "Priya Shah",
        "vouched_by_github": "example-pshah",
        "relationship": "peer",
        "date": "2026-08-10"
      }
    ],
    "contact": {
      "linkedin": "https://www.linkedin.com/in/example"
    },
    "contact_methods": [
      {
        "type": "email_base64",
        "value": "YW1hcmFAZXhhbXBsZS5jb20=",
        "preferred": true
      }
    ],
    "updated": "2026-09-30"
  },
  {
    "schema_version": "1.1",
    "id": "demo-mateo-ferreira",
    "name": "Mateo Ferreira",
    "pronouns": "he/him",
    "headline": "Staff platform engineer — Kubernetes, developer experience and cloud cost",
    "summary": "I build internal platforms that product teams actually want to use, and keep the cloud bill honest along the way.",
    "seniority": "staff",
    "region": "latam",
    "location": {
      "country": "BR",
      "city": "Florianópolis"
    },
    "timezone": "UTC-3",
    "work_preferences": [
      "contract_b2b"
    ],
    "availability": "2_weeks",
    "languages": [
      {
        "language": "Portuguese",
        "proficiency": "native"
      },
      {
        "language": "English",
        "proficiency": "fluent"
      },
      {
        "language": "Spanish",
        "proficiency": "professional"
      }
    ],
    "core_competencies": [
      "kubernetes",
      "platform-engineering",
      "terraform",
      "aws",
      "go",
      "finops",
      "observability"
    ],
    "major_impact": [
      {
        "title": "Internal developer platform for 300 engineers",
        "role": "Tech lead (team of 6)",
        "organization": "Latin American e-commerce marketplace",
        "summary": "Designed a golden-path platform on EKS with templated services, preview environments and built-in observability.",
        "architecture": [
          "kubernetes",
          "argo-cd",
          "terraform",
          "opentelemetry"
        ],
        "metrics": [
          "New service to production: 2 weeks → 40 minutes",
          "Cloud spend down 31%"
        ]
      }
    ],
    "proof_of_work": [
      {
        "title": "Contributions to Karpenter",
        "url": "https://github.com/example/karpenter",
        "type": "open_source_contribution"
      },
      {
        "title": "Write-up: Cutting EKS costs by a third",
        "url": "https://example.com/blog/eks-costs",
        "type": "case_study"
      }
    ],
    "vouches": [
      {
        "vouched_by": "Lucía Gómez",
        "vouched_by_github": "example-lgomez",
        "relationship": "manager",
        "statement": "Mateo's platform work changed how our whole engineering org ships.",
        "date": "2026-07-19"
      }
    ],
    "contact": {
      "calendar": "https://cal.com/example"
    },
    "contact_methods": [
      {
        "type": "email_base64",
        "value": "bWF0ZW9AZXhhbXBsZS5jb20=",
        "preferred": true
      },
      {
        "type": "signal",
        "value": "bWF0ZW8uNDI="
      }
    ],
    "updated": "2026-09-12"
  },
  {
    "schema_version": "1.1",
    "id": "demo-anjali-rao",
    "name": "Anjali Rao",
    "headline": "Principal ML engineer — search ranking and recommendation systems",
    "seniority": "principal",
    "region": "apac",
    "location": {
      "country": "IN",
      "city": "Bengaluru"
    },
    "timezone": "UTC+5:30",
    "work_preferences": [
      "fulltime_eor",
      "fractional"
    ],
    "availability": "3_months",
    "languages": [
      {
        "language": "English",
        "proficiency": "fluent"
      },
      {
        "language": "Hindi",
        "proficiency": "native"
      },
      {
        "language": "Kannada",
        "proficiency": "native"
      }
    ],
    "core_competencies": [
      "machine-learning",
      "search",
      "recommendation-systems",
      "python",
      "pytorch",
      "feature-stores",
      "mlops"
    ],
    "major_impact": [
      {
        "title": "Learning-to-rank search for a 90M-user travel app",
        "role": "Principal engineer",
        "summary": "Replaced hand-tuned relevance rules with a learning-to-rank stack, plus an offline/online evaluation loop the product team could run on its own.",
        "architecture": [
          "pytorch",
          "feature-store",
          "vector-search"
        ],
        "metrics": [
          "Search conversion +14%",
          "Experiment cycle: 3 weeks → 3 days"
        ]
      },
      {
        "title": "Company-wide ML platform",
        "role": "Architect",
        "summary": "Unified training, feature and serving infrastructure for eleven ML teams.",
        "metrics": [
          "Model deployment time down 85%"
        ]
      }
    ],
    "proof_of_work": [
      {
        "title": "Paper: Counterfactual evaluation for travel search",
        "url": "https://example.com/papers/counterfactual",
        "type": "publication"
      }
    ],
    "vouches": [],
    "contact": {
      "linkedin": "https://www.linkedin.com/in/example"
    },
    "updated": "2026-10-01"
  },
  {
    "schema_version": "1.1",
    "id": "demo-liam-tremblay",
    "name": "Liam Tremblay",
    "pronouns": "they/them",
    "headline": "Security architect — zero-trust networks and identity for regulated industries",
    "seniority": "distinguished",
    "region": "canada",
    "location": {
      "country": "CA",
      "city": "Montréal"
    },
    "timezone": "UTC-5",
    "work_preferences": [
      "contract_b2b",
      "fulltime_eor",
      "fractional"
    ],
    "availability": "immediately",
    "languages": [
      {
        "language": "French",
        "proficiency": "native"
      },
      {
        "language": "English",
        "proficiency": "native"
      }
    ],
    "core_competencies": [
      "security-architecture",
      "zero-trust",
      "identity",
      "oauth",
      "rust",
      "threat-modeling",
      "compliance"
    ],
    "major_impact": [
      {
        "title": "Zero-trust migration for a federally regulated bank",
        "role": "Principal security architect",
        "summary": "Took 1,400 internal services off VPN-based trust and onto identity-aware proxies with short-lived workload credentials.",
        "architecture": [
          "spiffe",
          "envoy",
          "oauth",
          "hsm"
        ],
        "metrics": [
          "Standing credentials eliminated",
          "Passed OSFI audit with zero findings"
        ]
      }
    ],
    "proof_of_work": [
      {
        "title": "Threat-modelling playbook (open source)",
        "url": "https://github.com/example/threat-playbook",